{
  "$schema": "http://json-schema.org/draft-07/schema#",
  "title": "Signals file (data/latest/signals.json)",
  "type": "object",
  "required": ["schema_version", "generated_at", "theme_signals", "pair_signals"],
  "definitions": {
    "signalType": { "enum": ["resonance", "transmission", "divergence", null] },
    "directionType": { "enum": ["up", "down", null] },
    "votes": {
      "type": "object",
      "required": ["short", "mid", "long"],
      "properties": {
        "short": { "$ref": "#/definitions/signalType" },
        "mid":   { "$ref": "#/definitions/signalType" },
        "long":  { "$ref": "#/definitions/signalType" }
      }
    }
  },
  "properties": {
    "schema_version": { "type": "string" },
    "generated_at": { "type": "string" },
    "theme_signals": {
      "type": "array",
      "items": {
        "type": "object",
        "required": ["theme_id", "signal", "trigger_cn_etf", "votes", "description"],
        "properties": {
          "theme_id":       { "type": "string" },
          "signal":         { "$ref": "#/definitions/signalType" },
          "direction":      { "$ref": "#/definitions/directionType" },
          "trigger_cn_etf": { "type": ["string", "null"] },
          "votes":          { "$ref": "#/definitions/votes" },
          "description":    { "type": "string" }
        }
      }
    },
    "pair_signals": {
      "type": "array",
      "items": {
        "type": "object",
        "required": ["theme_id", "cn_code", "mapping_score", "confidence", "signal", "votes"],
        "properties": {
          "theme_id":      { "type": "string" },
          "cn_code":       { "type": "string" },
          "mapping_score": { "type": ["integer", "null"], "minimum": 0, "maximum": 100 },
          "confidence":    { "type": "integer", "minimum": 0, "maximum": 100 },
          "signal":        { "$ref": "#/definitions/signalType" },
          "votes":         { "$ref": "#/definitions/votes" }
        }
      }
    }
  }
}
