{
  "schema_version": "1.0",
  "generated_at": "2022-05-11T16:00:00+08:00",
  "theme_signals": [
    {
      "theme_id": "storage_dram",
      "signal": null,
      "trigger_cn_etf": null,
      "votes": {
        "short": null,
        "mid": null,
        "long": null
      },
      "description": "美股存储芯片动量观察中"
    },
    {
      "theme_id": "semiconductor",
      "signal": null,
      "trigger_cn_etf": null,
      "votes": {
        "short": null,
        "mid": null,
        "long": null
      },
      "description": "美股半导体动量观察中"
    },
    {
      "theme_id": "cybersecurity",
      "signal": null,
      "trigger_cn_etf": null,
      "votes": {
        "short": null,
        "mid": null,
        "long": null
      },
      "description": "美股网络安全动量观察中"
    },
    {
      "theme_id": "ai_compute",
      "signal": null,
      "trigger_cn_etf": null,
      "votes": {
        "short": null,
        "mid": null,
        "long": null
      },
      "description": "美股AI算力动量观察中"
    },
    {
      "theme_id": "energy_oil",
      "signal": "resonance",
      "trigger_cn_etf": "162411",
      "votes": {
        "short": null,
        "mid": "resonance",
        "long": "resonance"
      },
      "description": "美股原油/油气中长期走强"
    },
    {
      "theme_id": "cn_coal",
      "signal": null,
      "trigger_cn_etf": null,
      "votes": {
        "short": null,
        "mid": null,
        "long": null
      },
      "description": "煤炭（A 股本土赛道）"
    },
    {
      "theme_id": "new_energy_vehicle",
      "signal": null,
      "trigger_cn_etf": null,
      "votes": {
        "short": null,
        "mid": null,
        "long": null
      },
      "description": "美股新能源车动量观察中"
    },
    {
      "theme_id": "cn_battery",
      "signal": null,
      "trigger_cn_etf": null,
      "votes": {
        "short": null,
        "mid": null,
        "long": null
      },
      "description": "美股锂电池动量观察中"
    },
    {
      "theme_id": "cn_chemicals",
      "signal": null,
      "trigger_cn_etf": null,
      "votes": {
        "short": null,
        "mid": null,
        "long": null
      },
      "description": "化工（A 股本土赛道）"
    },
    {
      "theme_id": "robotics",
      "signal": null,
      "trigger_cn_etf": null,
      "votes": {
        "short": null,
        "mid": null,
        "long": null
      },
      "description": "美股机器人动量观察中"
    },
    {
      "theme_id": "gold",
      "signal": null,
      "trigger_cn_etf": null,
      "votes": {
        "short": null,
        "mid": null,
        "long": null
      },
      "description": "美股黄金动量观察中"
    },
    {
      "theme_id": "cn_base_metals",
      "signal": null,
      "trigger_cn_etf": null,
      "votes": {
        "short": null,
        "mid": null,
        "long": null
      },
      "description": "美股有色金属动量观察中"
    },
    {
      "theme_id": "china_internet",
      "signal": null,
      "trigger_cn_etf": null,
      "votes": {
        "short": null,
        "mid": null,
        "long": null
      },
      "description": "美股中概互联网/港股动量观察中"
    },
    {
      "theme_id": "cn_brokerage",
      "signal": null,
      "trigger_cn_etf": null,
      "votes": {
        "short": null,
        "mid": null,
        "long": null
      },
      "description": "券商（A 股本土赛道）"
    },
    {
      "theme_id": "cn_banking",
      "signal": null,
      "trigger_cn_etf": null,
      "votes": {
        "short": null,
        "mid": null,
        "long": null
      },
      "description": "美股银行动量观察中"
    },
    {
      "theme_id": "cn_insurance",
      "signal": null,
      "trigger_cn_etf": null,
      "votes": {
        "short": null,
        "mid": null,
        "long": null
      },
      "description": "美股保险动量观察中"
    },
    {
      "theme_id": "solar_clean_energy",
      "signal": null,
      "trigger_cn_etf": null,
      "votes": {
        "short": null,
        "mid": null,
        "long": null
      },
      "description": "美股光伏/清洁能源动量观察中"
    },
    {
      "theme_id": "biotech",
      "signal": null,
      "trigger_cn_etf": null,
      "votes": {
        "short": null,
        "mid": null,
        "long": null
      },
      "description": "美股生物科技/创新药动量观察中"
    },
    {
      "theme_id": "aerospace_defense",
      "signal": null,
      "trigger_cn_etf": null,
      "votes": {
        "short": null,
        "mid": null,
        "long": null
      },
      "description": "美股航天军工动量观察中"
    },
    {
      "theme_id": "rare_earth",
      "signal": null,
      "trigger_cn_etf": null,
      "votes": {
        "short": null,
        "mid": null,
        "long": null
      },
      "description": "美股稀土/新材料动量观察中"
    },
    {
      "theme_id": "cn_rare_metals",
      "signal": null,
      "trigger_cn_etf": null,
      "votes": {
        "short": null,
        "mid": null,
        "long": null
      },
      "description": "稀有金属（A 股本土赛道）"
    },
    {
      "theme_id": "cn_liquor",
      "signal": null,
      "trigger_cn_etf": null,
      "votes": {
        "short": null,
        "mid": null,
        "long": null
      },
      "description": "白酒（A 股本土赛道）"
    },
    {
      "theme_id": "cn_consumer",
      "signal": "transmission",
      "trigger_cn_etf": "159936",
      "votes": {
        "short": null,
        "mid": "transmission",
        "long": "transmission"
      },
      "description": "美股领先, A股尚未完全跟随"
    },
    {
      "theme_id": "cn_consumer_staples",
      "signal": null,
      "trigger_cn_etf": null,
      "votes": {
        "short": null,
        "mid": null,
        "long": null
      },
      "description": "主要消费（A 股本土赛道）"
    },
    {
      "theme_id": "cn_medical_devices",
      "signal": null,
      "trigger_cn_etf": null,
      "votes": {
        "short": null,
        "mid": null,
        "long": null
      },
      "description": "医疗器械（A 股本土赛道）"
    },
    {
      "theme_id": "cn_home_appliances",
      "signal": null,
      "trigger_cn_etf": null,
      "votes": {
        "short": null,
        "mid": null,
        "long": null
      },
      "description": "家电（A 股本土赛道）"
    },
    {
      "theme_id": "cn_real_estate",
      "signal": null,
      "trigger_cn_etf": null,
      "votes": {
        "short": null,
        "mid": null,
        "long": null
      },
      "description": "房地产（A 股本土赛道）"
    },
    {
      "theme_id": "cn_media",
      "signal": null,
      "trigger_cn_etf": null,
      "votes": {
        "short": null,
        "mid": null,
        "long": null
      },
      "description": "传媒（A 股本土赛道）"
    },
    {
      "theme_id": "cn_gaming",
      "signal": null,
      "trigger_cn_etf": null,
      "votes": {
        "short": null,
        "mid": null,
        "long": null
      },
      "description": "游戏动漫（A 股本土赛道）"
    },
    {
      "theme_id": "cn_power",
      "signal": null,
      "trigger_cn_etf": null,
      "votes": {
        "short": null,
        "mid": null,
        "long": null
      },
      "description": "电力（A 股本土赛道）"
    }
  ],
  "pair_signals": [
    {
      "theme_id": "storage_dram",
      "cn_code": "512480",
      "mapping_score": null,
      "confidence": 60,
      "signal": null,
      "votes": {
        "short": "transmission",
        "mid": null,
        "long": null
      }
    },
    {
      "theme_id": "storage_dram",
      "cn_code": "512760",
      "mapping_score": null,
      "confidence": 60,
      "signal": null,
      "votes": {
        "short": "transmission",
        "mid": null,
        "long": null
      }
    },
    {
      "theme_id": "semiconductor",
      "cn_code": "512480",
      "mapping_score": 2,
      "confidence": 90,
      "signal": null,
      "votes": {
        "short": "transmission",
        "mid": null,
        "long": null
      }
    },
    {
      "theme_id": "semiconductor",
      "cn_code": "159995",
      "mapping_score": 5,
      "confidence": 90,
      "signal": null,
      "votes": {
        "short": "transmission",
        "mid": null,
        "long": null
      }
    },
    {
      "theme_id": "semiconductor",
      "cn_code": "159516",
      "mapping_score": null,
      "confidence": 60,
      "signal": null,
      "votes": {
        "short": null,
        "mid": null,
        "long": null
      }
    },
    {
      "theme_id": "cybersecurity",
      "cn_code": "512720",
      "mapping_score": 3,
      "confidence": 60,
      "signal": null,
      "votes": {
        "short": null,
        "mid": null,
        "long": null
      }
    },
    {
      "theme_id": "ai_compute",
      "cn_code": "515980",
      "mapping_score": 2,
      "confidence": 90,
      "signal": null,
      "votes": {
        "short": "transmission",
        "mid": null,
        "long": null
      }
    },
    {
      "theme_id": "ai_compute",
      "cn_code": "588000",
      "mapping_score": 5,
      "confidence": 60,
      "signal": null,
      "votes": {
        "short": "transmission",
        "mid": null,
        "long": null
      }
    },
    {
      "theme_id": "energy_oil",
      "cn_code": "162411",
      "mapping_score": 0,
      "confidence": 90,
      "signal": "resonance",
      "votes": {
        "short": null,
        "mid": "resonance",
        "long": "resonance"
      }
    },
    {
      "theme_id": "new_energy_vehicle",
      "cn_code": "515030",
      "mapping_score": 25,
      "confidence": 90,
      "signal": null,
      "votes": {
        "short": "transmission",
        "mid": null,
        "long": null
      }
    },
    {
      "theme_id": "cn_battery",
      "cn_code": "159755",
      "mapping_score": 68,
      "confidence": 90,
      "signal": null,
      "votes": {
        "short": "transmission",
        "mid": null,
        "long": null
      }
    },
    {
      "theme_id": "robotics",
      "cn_code": "562500",
      "mapping_score": 10,
      "confidence": 90,
      "signal": null,
      "votes": {
        "short": "transmission",
        "mid": null,
        "long": null
      }
    },
    {
      "theme_id": "robotics",
      "cn_code": "159559",
      "mapping_score": null,